{
  "schema_version": "1.0",
  "report_type": "taiwan_equity_chip_flow_analysis",
  "purpose": "供 AI 接續分析用的自我描述資料包。另一個模型/後續排程可直接讀取本結構,依 open_questions 與 conventions 續作分析。",
  "as_of_date": "2026-06-30",
  "generated_at": "2026-07-01",
  "language": "zh-Hant",
  "market_scope": "TWSE集中市場(上市) + TPEx櫃買 + TAIFEX期貨/選擇權 + 美股外圍(Yahoo)",
  "analysis_window": {
    "start": "2026-05-15",
    "end": "2026-06-30",
    "trading_days": 32
  },
  "conventions": {
    "currency": "TWD",
    "amount_unit_default": "億元 (=1e8 TWD)",
    "net_buy_sell_sign": "正=買超/淨多; 負=賣超/淨空",
    "futures_oi_unit": "口(contracts); 負=淨空",
    "cumulative": "foreign_cum/trust_cum/dealer_cum/adl 為區間內累計值(從 window 起算)",
    "valuation": "pe/pb/yd 為『全體上市股票中位數』,非市值加權指數本益比(後者由台積電主導,另計)",
    "external_calendar": "sox/ndx/dxy/tnx/vix 為美股交易日,與台股日期可能小幅錯位",
    "series_alignment": "所有序列已對齊 labels(台股交易日 MM/DD);缺值以 null 表示",
    "adr_premium": "台積電ADR溢價% = (TSM_USD/5 * USDTWD)/2330_TWD - 1;正=ADR溢價(全球溢價買TSMC)"
  },
  "data_sources": [
    {
      "name": "TWSE BFI82U",
      "use": "三大法人買賣金額(現貨)"
    },
    {
      "name": "TWSE FMTQIK",
      "use": "加權指數收盤/成交量"
    },
    {
      "name": "TWSE MI_MARGN",
      "use": "融資融券餘額"
    },
    {
      "name": "TWSE TWT93U",
      "use": "借券賣出餘額(逐檔加總)"
    },
    {
      "name": "TWSE MI_INDEX",
      "use": "漲跌家數→ADL"
    },
    {
      "name": "TWSE BWIBBU_d",
      "use": "個股P/E/P/B/殖利率→中位數"
    },
    {
      "name": "TWSE T86",
      "use": "三大法人買賣超個股"
    },
    {
      "name": "TAIFEX futContractsDate",
      "use": "三大法人期貨(外資台指期/散戶小台)"
    },
    {
      "name": "TAIFEX pcRatio",
      "use": "選擇權Put/Call未平倉比"
    },
    {
      "name": "Yahoo Finance",
      "use": "SOX/Nasdaq/TSMC-ADR/2330/DXY/US10Y/VIX/USDTWD"
    }
  ],
  "field_legend": {
    "index": "加權指數(收盤)",
    "volume": "集中市場成交金額(億元)",
    "foreign_cum": "外資及陸資 現貨累計買賣超(億元)",
    "trust_cum": "投信 現貨累計買賣超(億元)",
    "dealer_cum": "自營商 現貨累計買賣超(億元)",
    "fut_oi": "外資 台指期(TX)未平倉多空淨額(口)",
    "retail_mtx": "散戶 小型台指未平倉淨額(口),=-(三大法人小台淨額);正=淨多",
    "margin_fin": "融資餘額(億元)",
    "margin_short": "融券餘額(張)",
    "sbl": "借券賣出餘額(億股)",
    "pcr": "選擇權Put/Call未平倉比(%);>150偏悲觀,<100偏樂觀",
    "pe": "全體上市 本益比 中位數",
    "pb": "全體上市 股價淨值比 中位數",
    "yd": "全體上市 殖利率(%) 中位數",
    "sox": "費城半導體指數",
    "ndx": "那斯達克指數",
    "dxy": "美元指數",
    "tnx": "美債10年期殖利率(%)",
    "vix": "美股VIX恐慌指數",
    "adr_prem": "台積電ADR溢價(%)",
    "otc": "櫃買(TPEx)指數",
    "fx": "美元兌台幣 USD/TWD",
    "adl": "騰落線(累計 上漲家數-下跌家數,股票)"
  },
  "labels": [
    "05/15",
    "05/18",
    "05/19",
    "05/20",
    "05/21",
    "05/22",
    "05/25",
    "05/26",
    "05/27",
    "05/28",
    "05/29",
    "06/01",
    "06/02",
    "06/03",
    "06/04",
    "06/05",
    "06/08",
    "06/09",
    "06/10",
    "06/11",
    "06/12",
    "06/15",
    "06/16",
    "06/17",
    "06/18",
    "06/22",
    "06/23",
    "06/24",
    "06/25",
    "06/26",
    "06/29",
    "06/30"
  ],
  "series": {
    "index": [
      41172.36,
      40891.82,
      40175.56,
      40020.82,
      41368.21,
      42267.97,
      43644.4,
      43525.37,
      44256.8,
      43636.44,
      44732.94,
      45337.91,
      45557.31,
      46459.16,
      45677.46,
      45070.94,
      43502.78,
      44704.44,
      43225.54,
      43149.46,
      44169.04,
      45396.99,
      45809.19,
      45877.39,
      46465.2,
      47741.51,
      47100.65,
      46043.6,
      46255.26,
      44571.76,
      44999.9,
      46125.91
    ],
    "volume": [
      13749,
      10420,
      11512,
      10276,
      10476,
      12369,
      13527,
      15497,
      16301,
      16707,
      19170,
      16111,
      16964,
      15175,
      13256,
      13198,
      12166,
      12241,
      14241,
      13385,
      11692,
      11157,
      12622,
      11546,
      16062,
      15158,
      16724,
      15390,
      13681,
      16728,
      10454,
      12661
    ],
    "foreign_cum": [
      -104.3,
      -556.7,
      -1189.0,
      -1655.2,
      -1051.8,
      -290.5,
      204.1,
      558.5,
      939.8,
      558.4,
      1359.9,
      1728.0,
      1836.5,
      2270.4,
      1513.6,
      687.3,
      -251.3,
      -1168.6,
      -2104.3,
      -2462.1,
      -2175.2,
      -1709.9,
      -1301.9,
      -1508.7,
      -1297.3,
      -612.7,
      -998.6,
      -2772.7,
      -3177.8,
      -4609.7,
      -4653.0,
      -4658.1
    ],
    "trust_cum": [
      -13.7,
      153.0,
      234.6,
      336.7,
      390.5,
      502.8,
      586.9,
      640.8,
      598.6,
      536.5,
      606.7,
      684.3,
      712.5,
      768.0,
      809.7,
      825.9,
      913.6,
      1146.5,
      1313.4,
      1445.9,
      1588.2,
      1652.7,
      1770.9,
      1768.8,
      1715.3,
      1610.1,
      1682.4,
      1715.4,
      1889.6,
      1990.6,
      2135.8,
      2139.5
    ],
    "dealer_cum": [
      -249.4,
      -388.7,
      -612.2,
      -807.9,
      -612.0,
      -417.2,
      -348.3,
      -299.2,
      -330.5,
      -480.9,
      -324.8,
      -389.9,
      -547.6,
      -521.6,
      -735.3,
      -1019.6,
      -1511.1,
      -1578.0,
      -1983.5,
      -2107.5,
      -2018.1,
      -1892.8,
      -1832.0,
      -1874.6,
      -1719.8,
      -1598.7,
      -1768.6,
      -2133.4,
      -2203.4,
      -2910.8,
      -2956.7,
      -2810.9
    ],
    "fut_oi": [
      -50963,
      -44996,
      -45376,
      -42744,
      -44454,
      -46483,
      -51458,
      -54391,
      -56302,
      -58196,
      -60650,
      -64673,
      -67018,
      -66772,
      -69476,
      -69146,
      -65501,
      -61871,
      -61949,
      -63168,
      -65039,
      -66734,
      -69847,
      -67394,
      -68337,
      -70290,
      -76502,
      -83605,
      -81051,
      -76391,
      -76627,
      -83063
    ],
    "retail_mtx": [
      null,
      null,
      null,
      null,
      null,
      null,
      null,
      null,
      null,
      null,
      null,
      null,
      null,
      null,
      null,
      null,
      null,
      null,
      null,
      null,
      9801,
      13498,
      16227,
      10412,
      5672,
      3096,
      11535,
      8469,
      6464,
      7062,
      1266,
      2849
    ],
    "margin_fin": [
      4928.0,
      5016.2,
      4968.9,
      5020.8,
      5111.5,
      5222.9,
      5304.8,
      5345.9,
      5362.7,
      5350.3,
      5563.6,
      5657.8,
      5669.7,
      5684.0,
      5726.4,
      5666.5,
      5510.1,
      5638.8,
      5468.1,
      5491.8,
      5570.3,
      5719.1,
      5713.1,
      null,
      5930.5,
      6050.4,
      5939.3,
      6074.6,
      6110.0,
      5909.3,
      5942.3,
      6116.5
    ],
    "margin_short": [
      231677,
      239437,
      239205,
      244522,
      262407,
      257442,
      232580,
      228387,
      241621,
      248097,
      241804,
      234867,
      260047,
      259795,
      269861,
      260933,
      237429,
      216203,
      219750,
      224344,
      224946,
      205177,
      194525,
      null,
      204357,
      202267,
      204255,
      202194,
      199161,
      203932,
      205287,
      194887
    ],
    "sbl": [
      381.4,
      383.6,
      386.2,
      389.6,
      389.9,
      390.3,
      391.0,
      394.1,
      394.8,
      399.7,
      401.1,
      396.6,
      387.9,
      381.1,
      377.3,
      377.1,
      379.0,
      381.2,
      385.6,
      386.9,
      386.2,
      380.2,
      377.8,
      373.8,
      372.7,
      370.1,
      366.0,
      361.2,
      355.0,
      356.0,
      356.7,
      356.1
    ],
    "pcr": [
      null,
      null,
      null,
      null,
      null,
      null,
      null,
      null,
      null,
      null,
      null,
      null,
      null,
      null,
      null,
      null,
      null,
      null,
      null,
      null,
      168.35,
      172.0,
      164.48,
      133.15,
      114.67,
      147.65,
      98.99,
      134.59,
      114.57,
      128.74,
      123.92,
      134.93
    ],
    "pe": [
      19.7,
      null,
      null,
      null,
      null,
      20.1,
      null,
      null,
      null,
      null,
      20.7,
      null,
      null,
      null,
      null,
      21.2,
      null,
      null,
      null,
      null,
      20.7,
      null,
      null,
      null,
      21.1,
      null,
      null,
      21.0,
      null,
      null,
      null,
      20.9
    ],
    "pb": [
      1.63,
      null,
      null,
      null,
      null,
      1.69,
      null,
      null,
      null,
      null,
      1.75,
      null,
      null,
      null,
      null,
      1.79,
      null,
      null,
      null,
      null,
      1.74,
      null,
      null,
      null,
      1.79,
      null,
      null,
      1.76,
      null,
      null,
      null,
      1.77
    ],
    "yd": [
      2.7,
      null,
      null,
      null,
      null,
      2.56,
      null,
      null,
      null,
      null,
      2.41,
      null,
      null,
      null,
      null,
      2.39,
      null,
      null,
      null,
      null,
      2.45,
      null,
      null,
      null,
      2.38,
      null,
      null,
      2.38,
      null,
      null,
      null,
      2.38
    ],
    "sox": [
      11588.4599609375,
      11302.51953125,
      11305.5,
      11813.2900390625,
      11964.080078125,
      12202.5400390625,
      null,
      12876.91015625,
      12702.1904296875,
      12829.1396484375,
      12829.3798828125,
      12965.650390625,
      13726.26953125,
      13916.9599609375,
      13617.5,
      12220.759765625,
      12906.6904296875,
      12657.8095703125,
      12206.4599609375,
      13171.4404296875,
      13371.4697265625,
      14099.6201171875,
      13294.2197265625,
      13477.0703125,
      14341.7802734375,
      14634.7197265625,
      13482.509765625,
      13458.2001953125,
      13940.8701171875,
      13203.5703125,
      13709.66015625,
      14246.9609375
    ],
    "ndx": [